Question,Response
"How much does it cost to study at the University of Stirling?","The cost of studying at the University of Stirling varies depending on factors such as your program, residency status, and whether you're studying full-time or part-time. You can find detailed information about tuition fees on our website or by contacting our student support services."
"What scholarships and funding opportunities are available at the University of Stirling?","We offer a wide range of scholarships and funding options for both undergraduate and postgraduate students. These scholarships are designed to help students achieve their potential and can help finance your course. You can explore the available scholarships on our website or contact our student support services for more information."
"How can I manage my finances while studying at the University of Stirling?","Managing your money is an important aspect of university life, and we have trained advisers who can provide tips and guidance on budgeting, assistance funding, and cost of living information. You can also access budgeting guides and other resources through our money support services."
"What are the payment options for tuition fees at the University of Stirling?","We provide a range of secure payment options for tuition fees, including paying in full before or upon enrollment or spreading the cost over manageable monthly installments. You can find more information about payment options on our website or by contacting our student support services."
"Are there additional fees apart from tuition fees at the University of Stirling?","Yes, there may be additional fees for certain undergraduate or postgraduate programs. These fees could include laboratory fees, field trip expenses, or administrative fees. You can find specific details about additional fees for your program on our website or by contacting our student support services."
"How can I get more information or assistance regarding fees and funding?","If you have any queries or need assistance regarding fees and funding, please get in touch with our student support services. Our trained advisers are here to help you navigate the process and find the best funding options for your situation."
